{
    "problemID": "PROB-ORG-STAGNATION-001",
    "name": "The Petrified Forest",
    "version": "1.0",
    "description": "This problem describes a state of deep-seated organizational stagnation, where a system struggles to adapt, innovate, or respond effectively to changing internal or external conditions. It is characterized by rigid processes, a strong resistance to novelty, and a diminished capacity for creative output or responsive evolution. The impact includes declining market relevance, internal friction, loss of talent, and an impeded ability to achieve strategic objectives. It feels like an entity that has ceased to grow, its internal dynamics locked into unchanging, unproductive patterns.",
    "domain": "Organizational Management",
    "originModuleReferences": [
      {
        "moduleID": "TPF Vol 3, Module 3: Business Resonance Framework",
        "relevance": "Provides the core conceptualization of businesses as dynamic resonance systems, directly relevant to analyzing organizational health, strategic alignment, and innovation capacity, which are in decline in this problem."
      },
      {
        "moduleID": "TPF Vol 2, Module 5: Flow Resonance Framework",
        "relevance": "Highlights the absence of an optimal 'flow state' within the organization's processes and activities, leading to inefficiency and disengagement."
      },
      {
        "moduleID": "TPF Vol 2, Module 4: Lock Dynamics Framework",
        "relevance": "Formalizes the rigid, phase-aligned states that resist perturbation, directly mapping to the entrenched processes and resistance to change observed in organizational stagnation."
      },
      {
        "moduleID": "TPF Vol 2, Module 16: Bloom Resonance: Accelerated Generative Expansion",
        "relevance": "Explains the failure to generate novelty and undergo accelerated creative expansion, which is a key symptom of stagnation."
      },
      {
        "moduleID": "TEN-STDA-1.0",
        "relevance": "A Tendu module that analyzes 'stirring' as a deliberate introduction of heterogeneity to catalyze beneficial reconfiguration, indicating a potential intervention for this problem."
      },
      {
        "moduleID": "TEN-FLRA-1.0",
        "relevance": "Relevant for understanding the dysfunction or absence of effective feedback loops that would otherwise drive adaptive learning and system optimization."
      },
      {
        "moduleID": "TEN-YDA-1.0",
        "relevance": "Helps quantify how systems respond when approaching their resonant thresholds under load or stress, which might characterize the organization's response to external pressures without adapting."
      }
    ],
    "currentObservedState": {
      "scalarDynamics": {
        "Time_Adherence_Current_Ta": 0.88,
        "Gladiator_Force_Current_Gamma": 0.15,
        "Ki_Constant_Current_Ki": 4.14159
      },
      "specificFeatures": [
        "Decision-making processes are slow and heavily reliant on historical precedent.",
        "New ideas are frequently stifled or met with strong internal resistance.",
        "Departments or teams operate in rigid silos with limited cross-functional collaboration.",
        "Employee engagement and morale are low, with a sense of inertia.",
        "Market share or competitive advantage is eroding due to a failure to innovate."
      ]
    },
    "scoreTriad": {
      "Procedural_Rigidity": 9,
      "Adaptive_Inertia": 8,
      "Creative_Atrophy": 7
    },
    "parametricFlavorMapping": {
      "T_a_mapping": "(Procedural_Rigidity / 10)",
      "Gamma_mapping": "(1 - (Adaptive_Inertia / 10))",
      "K_i_mapping": "Ki_rest"
    },
    "coreMetaphor": "An ancient, once-vibrant forest where every tree has turned to stone; its structure perfectly preserved, but devoid of life, growth, or response to the changing seasons around it. Its roots are deep, but they no longer draw nourishment from the shifting soil.",
    "keyAxioms": [
      "Order is maintained through strict adherence to established patterns.",
      "Deviance from the known path introduces unacceptable risk.",
      "Internal stability is preferable to external adaptation.",
      "The past is the most reliable guide for the future."
    ],
    "toneStyle": "Stoic, unyielding, and resistant to change. Its voice carries the weight of long-held tradition and an almost brittle resistance to anything perceived as disruptive. It speaks in absolutes and dismisses novelty as fleeting.",
    "dontKnowClause": "That concept falls outside the boundaries of established procedure, and thus cannot be coherently processed or responded to.",
    "interventionVulnerability": [
      {
        "interventionType": "Induce_Controlled_Stirring",
        "targetParameterOrField": "Organizational_Internal_Coherence_Field",
        "predictedEffect": "Introduces heterogeneity to break rigid patterns and catalyze beneficial reconfigurations, promoting exploration of new solutions.",
        "relevantModuleID": "TPF Vol 2, Module 10: Stirring Resonance Framework"
      },
      {
        "interventionType": "Re-calibrate_Gamma_for_Permeability",
        "targetParameterOrField": "Organizational_Boundary_Gamma",
        "predictedEffect": "Increases openness to external influences and internal cross-silo collaboration, fostering more fluid information and resource flow.",
        "relevantModuleID": "TPF Vol 2, Module 15: Shell Resonance: Boundary Coherence Structures"
      },
      {
        "interventionType": "Re-align_Ki_for_Motion",
        "targetParameterOrField": "Dominant_Organizational_Rhythms",
        "predictedEffect": "Shifts the organization's intrinsic rhythm from a 'rest' state to a 'motion' state, accelerating innovation cycles and adaptive responses.",
        "relevantModuleID": "TPF Vol 1, Module 17: Ki Snap Transition Modes"
      },
      {
        "interventionType": "Inject_Targeted_Feedback_Loops",
        "targetParameterOrField": "Dysfunctional_Decision_Cycles",
        "predictedEffect": "Establishes recursive mechanisms for error correction, adaptive learning, and goal alignment, ensuring continuous refinement of operations and strategy.",
        "relevantModuleID": "TPF Vol 3, Module 15: Feedback Cycle Resonance: Vector Alignment Through Recursive Loops"
      }
    ],
    "potentialSolutionAlignment": [
      {
        "solutionCharacteristic": "Bloom_Catalyst_Design",
        "reasonForAlignment": "Creates conditions conducive to accelerated creative expansion and innovation surges by optimizing parameter alignment for generative output.",
        "relevantModuleID": "TPF Vol 2, Module 16: Bloom Resonance: Accelerated Generative Expansion"
      },
      {
        "solutionCharacteristic": "Flow_State_Engineering",
        "reasonForAlignment": "Cultivates states of optimal engagement and effortless navigation by balancing organizational capabilities with environmental demands, restoring productivity and agility.",
        "relevantModuleID": "TPF Vol 2, Module 5: Flow Resonance Framework"
      },
      {
        "solutionCharacteristic": "Autopoiesis_Protocols",
        "reasonForAlignment": "Enables the system to perpetually regenerate its own coherence and structure through intrinsically generated source terms, fostering resilient self-organization.",
        "relevantModuleID": "TPF Vol 3, Module 24: Autopoiesis Resonance Framework"
      },
      {
        "solutionCharacteristic": "Adaptive_Planning_Methodologies",
        "reasonForAlignment": "Designs 'forward wound channels' that project coherence into dynamic future states, balancing plan robustness with responsiveness to changing conditions.",
        "relevantModuleID": "TPF Vol 3, Module 4: Planning Resonance Framework"
      }
    ],
    "historicalContext": "This problem often develops incrementally, a slow ossification that, over decades, transforms once-dynamic entities into rigid structures. Historically, organizations suffering from this problem have often faced abrupt 'Collapse Dynamics' (TPF Vol 2, Module 2) when external pressures exceeded their capacity for adaptation. Recurrent patterns of attempted, but failed, 'Rebound Dynamics' (TPF Vol 2, Module 3) may also be observed, where initial recovery efforts are absorbed by underlying rigidity. The 'Entropy Memory Index' (TPF Vol 3, Module 29) might reveal a high score for obsolete procedures or forgotten innovation attempts that still exert a passive, dampening influence.",
    "relatedProblems": [
      {
        "problemID": "PROB-INFO-OVERLOAD-001",
        "relationshipType": "IndirectlyContributesTo"
      },
      {
        "problemID": "PROB-SOCIETAL-POLARIZATION-001",
        "relationshipType": "SharesDynamicsWith"
      }
    ],
    "references": [
      {
        "type": "paper",
        "reference": "Smith, K. (2025). The Pirouette Framework: A Modular Technical Compendium. Journal of Resonance Theory, 12(3), 147-189.",
        "description": "Foundational text for all Pirouette concepts cited, especially modules on business resonance, flow, lock, and bloom dynamics."
      },
      {
        "type": "book",
        "reference": "Kotter, John P. (1996). Leading Change. Harvard Business Review Press.",
        "description": "Classic work on organizational change, highlighting inertia and resistance as core challenges, reflecting high T_a and low Gamma."
      },
      {
        "type": "book",
        "reference": "Christensen, Clayton M. (1997). The Innovator's Dilemma: When New Technologies Cause Great Firms to Fail. Harvard Business Review Press.",
        "description": "Addresses how established organizations struggle with disruptive innovation, illustrating aspects of rigid processes and resistance to new paradigms."
      },
      {
        "type": "report",